<?xml version="1.0" encoding="UTF-8"?>

<item:item xmlns:item="http://www.swordsandsorcery.com/item" xmlns:xsi="http://www.w3.org/2001/XMLSchema-instance"
           xsi:schemaLocation="http://www.swordsandsorcery.com/item ../schema.xsd">
    <item:id>105</item:id>
    <item:rarity>COMMON</item:rarity>
    <item:name>Bronze flail</item:name>
    <item:type>WEAPON</item:type>
    <item:subtype>TWO_HANDED_CRUSHING_WEAPONS</item:subtype>
    <item:weight>600</item:weight>
    <item:equipment>true</item:equipment>
    <item:modifiers>
        <item:modifier>
            <item:modifier>ATTACK</item:modifier>
            <item:amount>1</item:amount>
            <item:d2>1</item:d2>
        </item:modifier>
        <item:modifier>
            <item:modifier>DAMAGE</item:modifier>
            <item:amount>2</item:amount>
            <item:d6>1</item:d6>
        </item:modifier>
    </item:modifiers>
    <item:requirements>
        <item:requirement>
            <item:requirement>TWO_HANDED_CRUSHING_WEAPONS</item:requirement>
            <item:amount>1</item:amount>
        </item:requirement>
    </item:requirements>
    <item:price>
        <item:price-entry>
            <item:type>MONEY</item:type>
            <item:amount>50</item:amount>
        </item:price-entry>
    </item:price>
</item:item>