<?xml version="1.0" encoding="UTF-8"?>

<item:item xmlns:item="http://www.swordsandsorcery.com/item" xmlns:xsi="http://www.w3.org/2001/XMLSchema-instance"
           xsi:schemaLocation="http://www.swordsandsorcery.com/item ../schema.xsd">
    <item:id>212</item:id>
    <item:name>Bloodstone</item:name>
    <item:type>MATERIAL</item:type>
    <item:subtype>GEM</item:subtype>
    <item:weight>5</item:weight>
    <item:price>
        <item:price-entry>
            <item:type>MONEY</item:type>
            <item:amount>1000</item:amount>
        </item:price-entry>
    </item:price>
</item:item>