<?xml version="1.0" encoding="UTF-8"?>

<item:item xmlns:item="http://www.swordsandsorcery.com/item" xmlns:xsi="http://www.w3.org/2001/XMLSchema-instance"
           xsi:schemaLocation="http://www.swordsandsorcery.com/item ../schema.xsd">
    <item:id>33</item:id>
    <item:name>Scroll: Heal</item:name>
    <item:type>SCROLL</item:type>
    <item:weight>20</item:weight>
    <item:usable>true</item:usable>
    <item:use-effect-list>
        <item:effect target="com.morethanheroic.swords.combat.domain.effect.entry.LearnSpellEffectDefinition">
            <item:settings-list>
                <item:effect-setting>
                    <item:setting-name>spell-item-id</item:setting-name>
                    <item:setting-value>33</item:setting-value>
                </item:effect-setting>
                <item:effect-setting>
                    <item:setting-name>spell-id</item:setting-name>
                    <item:setting-value>1</item:setting-value>
                </item:effect-setting>
            </item:settings-list>
        </item:effect>
    </item:use-effect-list>
    <item:price>
        <item:price-entry>
            <item:type>MONEY</item:type>
            <item:amount>30</item:amount>
        </item:price-entry>
    </item:price>
</item:item>