<?xml version="1.0" encoding="UTF-8"?>

<item:item xmlns:item="http://www.swordsandsorcery.com/item" xmlns:xsi="http://www.w3.org/2001/XMLSchema-instance"
           xsi:schemaLocation="http://www.swordsandsorcery.com/item ../schema.xsd">
    <item:id>192</item:id>
    <item:rarity>COMMON</item:rarity>
    <item:name>King's blood</item:name>
    <item:type>MATERIAL</item:type>
    <item:subtype>HERB</item:subtype>
    <item:weight>1</item:weight>
    <item:price>
        <item:price-entry>
            <item:type>MONEY</item:type>
            <item:amount>10</item:amount>
        </item:price-entry>
    </item:price>
</item:item>