<?xml version="1.0" encoding="UTF-8"?>

<item:item xmlns:item="http://www.swordsandsorcery.com/item" xmlns:xsi="http://www.w3.org/2001/XMLSchema-instance"
           xsi:schemaLocation="http://www.swordsandsorcery.com/item ../schema.xsd">
    <item:id>247</item:id>
    <item:rarity>COMMON</item:rarity>
    <item:name>Avalon Robe</item:name>
    <item:type>ARMOR</item:type>
    <item:subtype>ROBE_ARMOR</item:subtype>
    <item:weight>400</item:weight>
    <item:equipment>true</item:equipment>
    <item:modifiers>
        <item:modifier>
            <item:modifier>DEFENSE</item:modifier>
            <item:amount>6</item:amount>
        </item:modifier>
        <item:modifier>
            <item:modifier>MAGIC_ATTACK</item:modifier>
            <item:amount>6</item:amount>
        </item:modifier>
        <item:modifier>
            <item:modifier>MANA</item:modifier>
            <item:amount>15</item:amount>
        </item:modifier>
    </item:modifiers>
    <item:requirements>
        <item:requirement>
            <item:requirement>ROBE_ARMOR</item:requirement>
            <item:amount>17</item:amount>
        </item:requirement>
    </item:requirements>
    <item:price>
        <item:price-entry>
            <item:type>MONEY</item:type>
            <item:amount>350</item:amount>
        </item:price-entry>
    </item:price>
</item:item>