<?xml version="1.0" encoding="UTF-8"?>

<item:item xmlns:item="http://www.swordsandsorcery.com/item" xmlns:xsi="http://www.w3.org/2001/XMLSchema-instance"
           xsi:schemaLocation="http://www.swordsandsorcery.com/item ../schema.xsd">
    <item:id>18</item:id>
    <item:rarity>COMMON</item:rarity>
    <item:name>Vial</item:name>
    <item:type>MATERIAL</item:type>
    <item:weight>20</item:weight>
    <item:usable>true</item:usable>
    <item:use-effect-list>
        <item:effect target="fill_vials"/>
    </item:use-effect-list>
    <item:description>You can fill a maximum of five of these for 1 movement point.</item:description>
    <item:price>
        <item:price-entry>
            <item:type>MONEY</item:type>
            <item:amount>3</item:amount>
        </item:price-entry>
    </item:price>
</item:item>