<?xml version="1.0" encoding="UTF-8"?>

<item:item xmlns:item="http://www.swordsandsorcery.com/item" xmlns:xsi="http://www.w3.org/2001/XMLSchema-instance"
           xsi:schemaLocation="http://www.swordsandsorcery.com/item ../schema.xsd">
    <item:id>95</item:id>
    <item:rarity>COMMON</item:rarity>
    <item:name>Robinia wand</item:name>
    <item:type>WEAPON</item:type>
    <item:subtype>WAND</item:subtype>
    <item:weight>200</item:weight>
    <item:equipment>true</item:equipment>
    <item:modifiers>
        <item:modifier>
            <item:modifier>MAGIC_ATTACK</item:modifier>
            <item:amount>2</item:amount>
            <item:d4>1</item:d4>
        </item:modifier>
    </item:modifiers>
    <item:requirements>
        <item:requirement>
            <item:requirement>WAND</item:requirement>
            <item:amount>1</item:amount>
        </item:requirement>
    </item:requirements>
    <item:price>
        <item:price-entry>
            <item:type>MONEY</item:type>
            <item:amount>30</item:amount>
        </item:price-entry>
    </item:price>
</item:item>