<?xml version="1.0" encoding="UTF-8"?>

<item:item xmlns:item="http://www.swordsandsorcery.com/item" xmlns:xsi="http://www.w3.org/2001/XMLSchema-instance"
           xsi:schemaLocation="http://www.swordsandsorcery.com/item ../schema.xsd">
    <item:id>201</item:id>
    <item:rarity>UNCOMMON</item:rarity>
    <item:name>Cure for the Thirsty</item:name>
    <item:type>POTION</item:type>
    <item:tradeable>false</item:tradeable>
    <item:usable>true</item:usable>
    <item:use-effect-list>
        <item:effect target="cure_vampirism"/>
        <item:effect target="remove_item">
            <item:settings-list>
                <item:effect-setting>
                    <item:setting-name>item</item:setting-name>
                    <item:setting-value>201</item:setting-value>
                </item:effect-setting>
                <item:effect-setting>
                    <item:setting-name>amount</item:setting-name>
                    <item:setting-value>1</item:setting-value>
                </item:effect-setting>
            </item:settings-list>
        </item:effect>
    </item:use-effect-list>
    <item:description>This potion will cleanse you from the course of vampirism.</item:description>
    <item:weight>3</item:weight>
    <item:price>
        <item:price-entry>
            <item:type>MONEY</item:type>
            <item:amount>1000</item:amount>
        </item:price-entry>
    </item:price>
</item:item>