<?xml version="1.0" encoding="UTF-8"?>

<item:item xmlns:item="http://www.swordsandsorcery.com/item" xmlns:xsi="http://www.w3.org/2001/XMLSchema-instance"
           xsi:schemaLocation="http://www.swordsandsorcery.com/item ../schema.xsd">
    <item:id>110</item:id>
    <item:name>Recipe: Bronze great axe</item:name>
    <item:type>RECIPE</item:type>
    <item:weight>1</item:weight>
    <item:usable>true</item:usable>
    <item:use-effect-list>
        <item:effect target="learn_recipe">
            <item:settings-list>
                <item:effect-setting>
                    <item:setting-name>recipe-item-id</item:setting-name>
                    <item:setting-value>110</item:setting-value>
                </item:effect-setting>
                <item:effect-setting>
                    <item:setting-name>recipe-id</item:setting-name>
                    <item:setting-value>39</item:setting-value>
                </item:effect-setting>
            </item:settings-list>
        </item:effect>
    </item:use-effect-list>
    <item:price>
        <item:price-entry>
            <item:type>MONEY</item:type>
            <item:amount>300</item:amount>
        </item:price-entry>
    </item:price>
</item:item>