<?xml version="1.0" encoding="UTF-8"?>

<item:item xmlns:item="http://www.swordsandsorcery.com/item" xmlns:xsi="http://www.w3.org/2001/XMLSchema-instance"
           xsi:schemaLocation="http://www.swordsandsorcery.com/item ../schema.xsd">
    <item:id>63</item:id>
    <item:name>Robinia shortbow</item:name>
    <item:type>WEAPON</item:type>
    <item:subtype>SHORTBOWS</item:subtype>
    <item:weight>0</item:weight>
    <item:equipment>true</item:equipment>
    <item:modifiers>
        <item:modifier>
            <item:modifier>AIMING</item:modifier>
            <item:amount>2</item:amount>
            <item:d4>1</item:d4>
        </item:modifier>
    </item:modifiers>
    <item:requirements>
        <item:requirement>
            <item:requirement>SHORTBOWS</item:requirement>
            <item:amount>1</item:amount>
        </item:requirement>
    </item:requirements>
    <item:price>
        <item:price-entry>
            <item:type>MONEY</item:type>
            <item:amount>20</item:amount>
        </item:price-entry>
    </item:price>
</item:item>