<?xml version="1.0" encoding="UTF-8"?>

<item:item xmlns:item="http://www.swordsandsorcery.com/item" xmlns:xsi="http://www.w3.org/2001/XMLSchema-instance"
           xsi:schemaLocation="http://www.swordsandsorcery.com/item ../schema.xsd">
    <item:id>14</item:id>
    <item:name>Apple</item:name>
    <item:type>FRUIT</item:type>
    <item:weight>10</item:weight>
    <item:usable>true</item:usable>
    <item:use-effect-list>
        <item:effect target="com.morethanheroic.swords.combat.domain.effect.entry.HealCombatEffectDefinition">
          	<item:settings-list>
              	<item:effect-setting>
                  	<item:setting-name>amount</item:setting-name>
                  	<item:setting-value>5</item:setting-value>
                </item:effect-setting>
            </item:settings-list>
      	</item:effect>
        <item:effect target="com.morethanheroic.swords.combat.domain.effect.entry.RemoveItemAmountEffectDefinition">
            <item:settings-list>
                <item:effect-setting>
                    <item:setting-name>item</item:setting-name>
                    <item:setting-value>14</item:setting-value>
                </item:effect-setting>
                <item:effect-setting>
                    <item:setting-name>amount</item:setting-name>
                    <item:setting-value>1</item:setting-value>
                </item:effect-setting>
            </item:settings-list>
        </item:effect>
    </item:use-effect-list>
    <item:price>
        <item:price-entry>
            <item:type>MONEY</item:type>
            <item:amount>3</item:amount>
        </item:price-entry>
    </item:price>
</item:item>