<?xml version="1.0" encoding="UTF-8"?>

<item:item xmlns:item="http://www.swordsandsorcery.com/item" xmlns:xsi="http://www.w3.org/2001/XMLSchema-instance"
           xsi:schemaLocation="http://www.swordsandsorcery.com/item ../schema.xsd">
    <item:id>163</item:id>
    <item:rarity>RARE</item:rarity>
    <item:name>Belt of Scavenging</item:name>
    <item:type>ARMOR</item:type>
    <item:subtype>BELT</item:subtype>
    <item:weight>1000</item:weight>
    <item:equipment>true</item:equipment>
    <item:modifiers>
        <item:modifier>
            <item:modifier>SCAVENGING_BONUS</item:modifier>
            <item:amount>20</item:amount>
        </item:modifier>
    </item:modifiers>
    <item:price>
        <item:price-entry>
            <item:type>MONEY</item:type>
            <item:amount>2000</item:amount>
        </item:price-entry>
    </item:price>
</item:item>