<?xml version="1.0" encoding="UTF-8"?>

<item:item xmlns:item="http://www.swordsandsorcery.com/item" xmlns:xsi="http://www.w3.org/2001/XMLSchema-instance"
           xsi:schemaLocation="http://www.swordsandsorcery.com/item ../schema.xsd">
    <item:id>111</item:id>
    <item:name>Lockpick</item:name>
    <item:type>TOOL</item:type>
    <item:weight>3</item:weight>
    <item:description>Used to pick locks on doors and chests. Required by the lockpicking skill.</item:description>
    <item:price>
        <item:price-entry>
            <item:type>MONEY</item:type>
            <item:amount>60</item:amount>
        </item:price-entry>
    </item:price>
</item:item>