<?xml version="1.0" encoding="UTF-8"?>

<item:item xmlns:item="http://www.swordsandsorcery.com/item" xmlns:xsi="http://www.w3.org/2001/XMLSchema-instance"
           xsi:schemaLocation="http://www.swordsandsorcery.com/item ../schema.xsd">
    <item:id>135</item:id>
    <item:name>Worn leather tunic</item:name>
    <item:type>ARMOR</item:type>
    <item:subtype>LIGHT_ARMOR</item:subtype>
    <item:weight>400</item:weight>
    <item:equipment>true</item:equipment>
    <item:modifiers>
        <item:modifier>
            <item:modifier>DEFENSE</item:modifier>
            <item:amount>1</item:amount>>
    </item:modifiers>
    <item:price>
        <item:price-entry>
            <item:type>MONEY</item:type>
            <item:amount>1</item:amount>
        </item:price-entry>
    </item:price>
</item:item>