<?xml version="1.0" encoding="UTF-8"?>

<item:item xmlns:item="http://www.swordsandsorcery.com/item" xmlns:xsi="http://www.w3.org/2001/XMLSchema-instance"
           xsi:schemaLocation="http://www.swordsandsorcery.com/item ../schema.xsd">
    <item:id>190</item:id>
    <item:name>Vial of blood</item:name>
    <item:type>MATERIAL</item:type>
    <item:weight>20</item:weight>
    <item:usable>true</item:usable>
    <item:description>Restore 8 health points when used by a vampire character but does 3 damage when used by anyone else.</item:description>
    <item:use-effect-list>
        <item:effect target="heal_vampire">
            <item:settings-list>
                <item:effect-setting>
                    <item:setting-name>heal-amount</item:setting-name>
                    <item:setting-value>8</item:setting-value>
                </item:effect-setting>
                <item:effect-setting>
                    <item:setting-name>damage-amount</item:setting-name>
                    <item:setting-value>3</item:setting-value>
                </item:effect-setting>
            </item:settings-list>
        </item:effect>
    </item:use-effect-list>
    <item:price>
        <item:price-entry>
            <item:type>MONEY</item:type>
            <item:amount>5</item:amount>
        </item:price-entry>
    </item:price>
</item:item>