<?xml version="1.0" encoding="UTF-8"?>

<item:item xmlns:item="http://www.swordsandsorcery.com/item" xmlns:xsi="http://www.w3.org/2001/XMLSchema-instance"
           xsi:schemaLocation="http://www.swordsandsorcery.com/item ../schema.xsd">
    <item:id>55</item:id>
    <item:name>Magical amulet</item:name>
    <item:type>AMULET</item:type>
    <item:weight>0</item:weight>
    <!--
        This is an unidentified thing, there must be 3 amulets in random, one for melee one for ranged and one for magic.
        All of them should be unidentified by default.
    -->
    <item:price>
        <item:price-entry>
            <item:type>MONEY</item:type>
            <item:amount>0</item:amount>
        </item:price-entry>
    </item:price>
</item:item>